{
  "schema": 1,
  "built_at": "2026-10-13T15:15:37+00:00",
  "plugins": [
    {
      "id": "classification-kit",
      "source": "git",
      "location": "https://github.com/vicentzamoras/dashai-classification-kit",
      "name": "Classification Kit",
      "description": "A tabular classification task with its own loader, baseline model and metric.",
      "authors": [
        {
          "name": "Vicente Zamora",
          "email": "",
          "url": "https://github.com/vicentzamoras"
        }
      ],
      "components": [
        "KitTabularClassificationTask",
        "KitCSVDataLoader",
        "KitDummyClassifier",
        "KitAccuracy"
      ],
      "component_types": [
        "Task",
        "DataLoader",
        "Model",
        "Metric"
      ],
      "project_urls": {
        "Homepage": "https://github.com/vicentzamoras/dashai-classification-kit",
        "Issues": "https://github.com/vicentzamoras/dashai-classification-kit/issues"
      },
      "license": "MIT",
      "releases": [
        {
          "tag": "v1.0.0",
          "version": "1.0.0",
          "min_app_version": "0.10.0",
          "sha256": "a3237add4214ee14863f633ba476ff70918eb4165735e7660943f7910adc6c2a",
          "trust_level": "github_source",
          "commit": "4949553973376e659a69479ea2cb64355d79e7a4",
          "published_at": "2026-10-08T15:20:17Z",
          "dependencies": []
        }
      ]
    },
    {
      "id": "echo-chat",
      "source": "git",
      "location": "https://github.com/vicentzamoras/dashai-echo-chat",
      "name": "Echo Chat",
      "description": "A chat model that echoes your message, or tells a joke with /joke.",
      "authors": [
        {
          "name": "Vicente Zamora",
          "email": "",
          "url": "https://github.com/vicentzamoras"
        }
      ],
      "components": [
        "EchoChatTask",
        "EchoModel"
      ],
      "component_types": [
        "GenerativeTask",
        "GenerativeModel"
      ],
      "project_urls": {
        "Homepage": "https://github.com/vicentzamoras/dashai-echo-chat",
        "Issues": "https://github.com/vicentzamoras/dashai-echo-chat/issues"
      },
      "license": "MIT",
      "releases": [
        {
          "tag": "v1.0.0",
          "version": "1.0.0",
          "min_app_version": "0.10.0",
          "sha256": "cbe257c6d3c0eee95bd2c552d0f085306e25898f655728e247f1f2d5d2b7f32a",
          "trust_level": "github_attested",
          "workflow": ".github/workflows/release.yaml",
          "signed_at": "2026-10-08T15:18:18+00:00",
          "commit": "796272d90f3eeacd37b001b3242e30141e6e28c1",
          "published_at": "2026-10-08T15:18:21Z",
          "dependencies": [
            "pyjokes>=0.6"
          ]
        }
      ]
    },
    {
      "id": "explainers-plus",
      "source": "git",
      "location": "https://github.com/centzlostres/explainers-plus",
      "name": "Explainers Plus",
      "description": "Global and local explanations for tabular classifiers.",
      "authors": [
        {
          "name": "John Doe",
          "email": "",
          "url": "https://github.com/centzlostres"
        }
      ],
      "components": [
        "PermutationImportancePlus",
        "KernelShapPlus"
      ],
      "component_types": [
        "GlobalExplainer",
        "LocalExplainer"
      ],
      "project_urls": {
        "Homepage": "https://github.com/centzlostres/explainers-plus",
        "Issues": "https://github.com/centzlostres/explainers-plus/issues"
      },
      "license": "MIT",
      "releases": [
        {
          "tag": "v1.0.0",
          "version": "1.0.0",
          "min_app_version": "0.10.0",
          "sha256": "f7926b568b494aee98c3876cc62122f862096daeae53046077c3c2b2c2f24d68",
          "trust_level": "github_attested",
          "workflow": ".github/workflows/release.yaml",
          "signed_at": "2026-10-08T16:05:32+00:00",
          "commit": "70caee3f345f88ba77b48cd435032a758ddedcfc",
          "published_at": "2026-10-08T16:05:20Z",
          "dependencies": []
        }
      ]
    }
  ],
  "removed": []
}
